{"files":[{"bytes":554563684,"md5":"824309369c26902aa520e4b5209977f7","name":"data.parquet","sha256":"259b5849a134e3318ed5e683bca0582d8c1005d1a008bb86094c8131ca1b2ff3"},{"bytes":11297,"md5":"cb52d1d73bf4bb54ebbfb466b94618de","name":"metadata.csv","sha256":"7800d85fb32b3cb22fd0997385a275fc98d8a01959d996b2a6aad45ed3d5d6f9"},{"bytes":228485,"md5":"30fee9cac0a83b8cd679b5e2f5dccf28","name":"CATS-DDD.pdf","sha256":"6d86bd481eb8194016ce2b1fd55a9fe6ae3f7208cb118a2db116d3eede6a2565"}],"labels":{"anomalies_in_first_million_rows":0,"category_matches":true,"contamination":0.03802,"end_convention":"end_time in metadata.csv is exclusive: segment = [start, end)","mismatched_rows":0,"segments_from_y":200,"segments_metadata":200},"ledger":[{"dropped":0,"reason":"as downloaded, md5 verified","rows_in":5000000,"rows_out":5000000,"stage":"raw data.parquet"},{"dropped":0,"reason":"no nulls, no gaps, no duplicates found, nothing imputed","rows_in":5000000,"rows_out":5000000,"stage":"clean (float32 cast, label check)"},{"dropped":0,"reason":"contiguous, covers all rows","rows_in":5000000,"rows_out":5000000,"stage":"split train/gbm_fit/val/test"}],"schema_version":"v1","tags":{"ledger":"DERIVED"}}
